{
  "schema_id": "https://schemas.reiyah.invalid/gate-a/1.1.0/gate-a-index.schema.json",
  "schema_version": "1.1.0",
  "artifact_id": "reiyah.artifact.gate-a-index-1.1.0",
  "index_id": "reiyah.gate-a-evidence-index",
  "version": "1.1.0",
  "as_of_date": "2026-08-23",
  "lifecycle_status": "proposed",
  "architecture_status": "architecture_complete",
  "operator_acceptance_state": "unaccepted",
  "operator_decision_binding": null,
  "mission_release_id": "reiyah.mission@1.1.0",
  "protocol_release_id": "reiyah.protocol.harbor-gate-a@1.1.0",
  "distribution_profile": "public_open_source",
  "source_ledger_version": "1.1.0",
  "prior_candidate_observation": {
    "artifact_id": "reiyah.artifact.gate-a-index-1.0.0",
    "version": "1.0.0",
    "sha256": "sha256:3341696a730d2c4a4788f19612fc547eff926715b321e6d6bea99e2850c11944",
    "observed_on": "2026-08-22",
    "distribution_state": "internal_candidate_not_published",
    "evidence_eligible": false
  },
  "artifacts": [
    {
      "role": "repository_metadata",
      "media_type": "text/plain",
      "digest_algorithm": "sha256",
      "artifact": {
        "artifact_id": "reiyah.artifact.indexed-gitattributes",
        "path": ".gitattributes",
        "sha256": "sha256:4611b4488511b5da659dc7dab92ad08f2a4e63cfe7def7fd5e2ea0152e6fe3d6",
        "version": "1.1.0"
      }
    },
    {
      "role": "repository_metadata",
      "media_type": "text/plain",
      "digest_algorithm": "sha256",
      "artifact": {
        "artifact_id": "reiyah.artifact.indexed-gitignore",
        "path": ".gitignore",
        "sha256": "sha256:4647af9a530ab1c16255a274529f8c9c948e08cfc44371486c056f693a78ad77",
        "version": "1.1.0"
      }
    },
    {
      "role": "repository_contract",
      "media_type": "text/markdown",
      "digest_algorithm": "sha256",
      "artifact": {
        "artifact_id": "reiyah.artifact.indexed-agents-md",
        "path": "AGENTS.md",
        "sha256": "sha256:946b0a2176b28b3c354b86c5c4ba91b54dcb0a026edcc48f9103b4b0488818ff",
        "version": "1.1.0"
      }
    },
    {
      "role": "citation_metadata",
      "media_type": "application/yaml",
      "digest_algorithm": "sha256",
      "artifact": {
        "artifact_id": "reiyah.artifact.indexed-citation-cff",
        "path": "CITATION.cff",
        "sha256": "sha256:5d87269d38429152504a08b2063e84c885d8e4fa8fbb4aa99a6597243ca96202",
        "version": "1.1.0"
      }
    },
    {
      "role": "contribution_policy",
      "media_type": "text/markdown",
      "digest_algorithm": "sha256",
      "artifact": {
        "artifact_id": "reiyah.artifact.indexed-contributing-md",
        "path": "CONTRIBUTING.md",
        "sha256": "sha256:5a8f9725e4a0739d71a597595f3a78a611c2c6a5a5ce4795ee0e3aaf5abdc4ae",
        "version": "1.1.0"
      }
    },
    {
      "role": "open_source_license",
      "media_type": "text/plain",
      "digest_algorithm": "sha256",
      "artifact": {
        "artifact_id": "reiyah.artifact.indexed-license",
        "path": "LICENSE",
        "sha256": "sha256:c71d239df91726fc519c6eb72d318ec65820627232b2f796219e87dcf35d0ab4",
        "version": "1.1.0"
      }
    },
    {
      "role": "attribution_notice",
      "media_type": "text/plain",
      "digest_algorithm": "sha256",
      "artifact": {
        "artifact_id": "reiyah.artifact.indexed-notice",
        "path": "NOTICE",
        "sha256": "sha256:399e9755a8da1c350fefebb018efc107f67365238c48ac63101a7a15a60a3b29",
        "version": "1.1.0"
      }
    },
    {
      "role": "repository_overview",
      "media_type": "text/markdown",
      "digest_algorithm": "sha256",
      "artifact": {
        "artifact_id": "reiyah.artifact.indexed-readme-md",
        "path": "README.md",
        "sha256": "sha256:16f2c234e5a2f6d68e7deaf3eca6351d7bef03c64dcf1ac92bb45662a2da1eff",
        "version": "1.1.0"
      }
    },
    {
      "role": "security_policy",
      "media_type": "text/markdown",
      "digest_algorithm": "sha256",
      "artifact": {
        "artifact_id": "reiyah.artifact.indexed-security-md",
        "path": "SECURITY.md",
        "sha256": "sha256:96258d55ac6fd9e9b11e6054b82a7e611c60f89b9ef90f01ee35e862d630991a",
        "version": "1.1.0"
      }
    },
    {
      "role": "architecture_specification",
      "media_type": "text/markdown",
      "digest_algorithm": "sha256",
      "artifact": {
        "artifact_id": "reiyah.artifact.indexed-docs-architecture-md",
        "path": "docs/ARCHITECTURE.md",
        "sha256": "sha256:410d887173e662da95c998a09669ea68898902a792aa8690576f0651e8687cae",
        "version": "1.1.0"
      }
    },
    {
      "role": "claims_and_non_claims",
      "media_type": "text/markdown",
      "digest_algorithm": "sha256",
      "artifact": {
        "artifact_id": "reiyah.artifact.indexed-docs-claims-and-non-claims-md",
        "path": "docs/CLAIMS_AND_NON_CLAIMS.md",
        "sha256": "sha256:2f19f8c61a719ceab109fe437087e7f29d16a378d34c58d9e2db249f5308f8d1",
        "version": "1.1.0"
      }
    },
    {
      "role": "frontier_baseline",
      "media_type": "text/markdown",
      "digest_algorithm": "sha256",
      "artifact": {
        "artifact_id": "reiyah.artifact.indexed-docs-frontier-baseline-2026-md",
        "path": "docs/FRONTIER_BASELINE_2026.md",
        "sha256": "sha256:dc982531dfe9586faa047007408e025f676a69d0711c54ead941790f79127b86",
        "version": "1.1.0"
      }
    },
    {
      "role": "glossary",
      "media_type": "text/markdown",
      "digest_algorithm": "sha256",
      "artifact": {
        "artifact_id": "reiyah.artifact.indexed-docs-glossary-md",
        "path": "docs/GLOSSARY.md",
        "sha256": "sha256:413b798167144c98762bc2721f51cfa7ceda1000d0c5488e0224637ea7a61ba5",
        "version": "1.1.0"
      }
    },
    {
      "role": "mathematical_specification",
      "media_type": "text/markdown",
      "digest_algorithm": "sha256",
      "artifact": {
        "artifact_id": "reiyah.artifact.indexed-docs-mathematical-specification-md",
        "path": "docs/MATHEMATICAL_SPECIFICATION.md",
        "sha256": "sha256:5999d4f3f7097fa363cf69a95bf7aaadc2cc2b7bc5bc8f28aef63a0901b68efc",
        "version": "1.1.0"
      }
    },
    {
      "role": "preimplementation_gate",
      "media_type": "text/markdown",
      "digest_algorithm": "sha256",
      "artifact": {
        "artifact_id": "reiyah.artifact.indexed-docs-pre-implementation-gate-md",
        "path": "docs/PRE_IMPLEMENTATION_GATE.md",
        "sha256": "sha256:bf8557fe4a7d6460025919a29a90191c056b9b10a9909bfef75cb7e5cfc1b2f7",
        "version": "1.1.0"
      }
    },
    {
      "role": "research_gap_register",
      "media_type": "text/markdown",
      "digest_algorithm": "sha256",
      "artifact": {
        "artifact_id": "reiyah.artifact.indexed-docs-research-gap-register-md",
        "path": "docs/RESEARCH_GAP_REGISTER.md",
        "sha256": "sha256:4c1eabf63ef4ef1ee688e9bdeef42b097cf85ab8a8f26481318e6f2e83be2d33",
        "version": "1.1.0"
      }
    },
    {
      "role": "research_operating_model",
      "media_type": "text/markdown",
      "digest_algorithm": "sha256",
      "artifact": {
        "artifact_id": "reiyah.artifact.indexed-docs-research-operating-model-md",
        "path": "docs/RESEARCH_OPERATING_MODEL.md",
        "sha256": "sha256:1f356d9e7df561fb010bf05bbf36ca216312530e88adb2340b27310a83ec91b5",
        "version": "1.1.0"
      }
    },
    {
      "role": "scientific_charter",
      "media_type": "text/markdown",
      "digest_algorithm": "sha256",
      "artifact": {
        "artifact_id": "reiyah.artifact.indexed-docs-scientific-charter-md",
        "path": "docs/SCIENTIFIC_CHARTER.md",
        "sha256": "sha256:b408ecd825084ea60bac6983c70cbeb508a2012855101c6cfc576a1c0db003de",
        "version": "1.1.0"
      }
    },
    {
      "role": "session_handoff",
      "media_type": "text/markdown",
      "digest_algorithm": "sha256",
      "artifact": {
        "artifact_id": "reiyah.artifact.indexed-docs-session-handoff-md",
        "path": "docs/SESSION_HANDOFF.md",
        "sha256": "sha256:24e977fd10ab5c6737996222e339252a5c7bd5ca26a2a06223f693717ba54ba4",
        "version": "1.1.0"
      }
    },
    {
      "role": "source_policy",
      "media_type": "text/markdown",
      "digest_algorithm": "sha256",
      "artifact": {
        "artifact_id": "reiyah.artifact.indexed-docs-source-policy-md",
        "path": "docs/SOURCE_POLICY.md",
        "sha256": "sha256:cf6bd5d43b16506643c2e715a4b4c73548f779eea01481f28d867891a9190df9",
        "version": "1.1.0"
      }
    },
    {
      "role": "standards_crosswalk",
      "media_type": "text/markdown",
      "digest_algorithm": "sha256",
      "artifact": {
        "artifact_id": "reiyah.artifact.indexed-docs-standards-crosswalk-md",
        "path": "docs/STANDARDS_CROSSWALK.md",
        "sha256": "sha256:074eca674d98bd186392d75f3e6abfe1a0e03aaf397da4057dbc32feecd1745d",
        "version": "1.1.0"
      }
    },
    {
      "role": "status_model",
      "media_type": "text/markdown",
      "digest_algorithm": "sha256",
      "artifact": {
        "artifact_id": "reiyah.artifact.indexed-docs-status-model-md",
        "path": "docs/STATUS_MODEL.md",
        "sha256": "sha256:6ca4b50bd47eec9671bdffd98aec60b244c907b0effa1da1105999f09041acdf",
        "version": "1.1.0"
      }
    },
    {
      "role": "threat_model",
      "media_type": "text/markdown",
      "digest_algorithm": "sha256",
      "artifact": {
        "artifact_id": "reiyah.artifact.indexed-docs-threat-model-md",
        "path": "docs/THREAT_MODEL.md",
        "sha256": "sha256:74ef14d61e8c12f0548ac02bb1a50f567a94490de835a3dccc1a97e958489a5c",
        "version": "1.1.0"
      }
    },
    {
      "role": "validation_specification",
      "media_type": "text/markdown",
      "digest_algorithm": "sha256",
      "artifact": {
        "artifact_id": "reiyah.artifact.indexed-docs-validation-md",
        "path": "docs/VALIDATION.md",